{
  "id": "synthesis_etf_institutional_flow_20260629_100814",
  "cluster": "etf_institutional_flow",
  "status": "generated",
  "tension": "Банки получили юридическое право хранить BTC — но Базель III требует $19.6 млн резервов на каждые $1.57 млн BTC, делая хранение экономически невозможным при нулевой доходности на резервный капитал",
  "narrative": "Конфигурация декабря 2022 повторяется: массовая капитуляция розницы при сохраняющемся институциональном спросе — однако базель III создаёт скрытый chokepoint: не запрещая BTC явно, регулятор ценообразованием вытесняет его из банковского баланса — пока не изменится коэффициент риска 1250%, институциональный спрос через банки остаётся структурно заблокированным",
  "takeaway": "Базель III создаёт скрытый chokepoint: не запрещая BTC явно, регулятор ценообразованием вытесняет его из банковского баланса — пока не изменится коэффициент риска 1250%, институциональный спрос через банки остаётся структурно заблокированным",
  "strength": "strong",
  "confidence": 1.0,
  "phase": "active",
  "score": 116,
  "signal_count": 9,
  "anchor_signal_id": "NAR-2026-0628-001",
  "phase_changed": false,
  "structural_change": {},
  "rationale": "Tension from NAR-2026-0628-001 (contradicts: 2, weight: primary); partA from MAC-2026-0618-001; phase: active; bridge: 'однако'; confidence: 1.00; signals_used: 9; ignored_duplicates: ['STR-2026-0618-002', 'STR-2026-0624-004']",
  "signals_used": [
    "NAR-2026-0628-001",
    "STR-2026-0622-005",
    "STR-2026-0619-001",
    "MAC-2026-0618-001",
    "STR-2026-0623-005",
    "STR-2026-0616-001",
    "MAC-2026-0624-001",
    "STR-2026-0623-004",
    "STR-2026-0620-001"
  ],
  "signals_ignored": [
    "STR-2026-0618-002",
    "STR-2026-0624-004"
  ],
  "generated_at": "2026-06-29T10:08:14.756700+00:00"
}