{
  "id": "synthesis_btc_treasury_competition_20260629_111301",
  "cluster": "btc_treasury_competition",
  "status": "generated",
  "tension": "Metaplanet строит регулируемую продуктовую фабрику на BTC-коллатерале при mNAV < 1x и $1.18 млрд нереализованного убытка — vs рынок не знает: это новый моат или leverage в регулируемой обёртке",
  "narrative": "BTC-казначейство эволюционирует от пассивного баланса к операционному движку: коллатерал → лицензия → продукты → комиссионный доход — тогда как корпоративное накопление BTC диверсифицируется по методам: добыча становится параллельным казначейским инструментом, снижая зависимость от рыночной цены при входе",
  "takeaway": "Корпоративное накопление BTC диверсифицируется по методам: добыча становится параллельным казначейским инструментом, снижая зависимость от рыночной цены при входе",
  "strength": "strong",
  "confidence": 1.0,
  "phase": "active",
  "score": 79,
  "signal_count": 7,
  "anchor_signal_id": "STR-2026-0626-001",
  "phase_changed": false,
  "structural_change": {},
  "rationale": "Tension from STR-2026-0626-001 (contradicts: 1, weight: primary); partA from STR-2026-0626-001; phase: active; bridge: 'тогда как'; confidence: 1.00; signals_used: 7; ignored_duplicates: ['STR-2026-0623-002']",
  "signals_used": [
    "STR-2026-0626-001",
    "INF-2026-0625-002",
    "STR-2026-0624-003",
    "STR-2026-0623-003",
    "STR-2026-0623-006",
    "STR-2026-0624-001",
    "SUP-2026-0624-001"
  ],
  "signals_ignored": [
    "STR-2026-0623-002"
  ],
  "generated_at": "2026-06-29T11:13:01.189780+00:00"
}