{
  "id": "synthesis_btc_infrastructure_growth_20260629_100814",
  "cluster": "btc_infrastructure_growth",
  "status": "generated",
  "tension": "BTC закрепляет полный стек регулируемой инфраструктуры в США (perps, Lightning, майнинг) — vs банковский уровень остаётся структурно заблокированным Базелем III при нулевой экономике хранения",
  "narrative": "Децентрализация Bitcoin-майнинга переходит от теории к практике: контроль над транзакционным слоем начинает смещаться от пулов к майнерам, устраняя главную регуляторную уязвимость сети — в то время как bitcoin развивается по двум несовместимым трекам: резервный актив и платёжная сеть работают, DeFi-слой не находит аудитории — BTC-держатели не хотят быть пользователями, они хотят быть владельцами",
  "takeaway": "Bitcoin развивается по двум несовместимым трекам: резервный актив и платёжная сеть работают, DeFi-слой не находит аудитории — BTC-держатели не хотят быть пользователями, они хотят быть владельцами",
  "strength": "strong",
  "confidence": 0.845,
  "phase": "active",
  "score": 93,
  "signal_count": 10,
  "anchor_signal_id": "INF-2026-0609-001",
  "phase_changed": false,
  "structural_change": {},
  "rationale": "Tension from INF-2026-0609-001 (contradicts: 2, weight: primary); partA from INF-2026-0625-001; phase: active; bridge: 'в то время как'; confidence: 0.85; signals_used: 10; ignored_duplicates: []",
  "signals_used": [
    "INF-2026-0609-001",
    "INF-2026-0625-001",
    "INF-2026-0623-001",
    "INF-2026-0621-001",
    "STR-2026-0622-006",
    "INF-2026-0624-001",
    "NAR-2026-0626-001",
    "INF-2026-0618-001",
    "INF-2026-0622-001",
    "INF-2026-0620-001"
  ],
  "signals_ignored": [],
  "generated_at": "2026-06-29T10:08:14.760742+00:00"
}